{
  "created_at": "2026-09-25T08:00:47Z",
  "dataset_id": "cnn_dailymail_20",
  "description": "20 item(s) from cnn_dailymail_20/",
  "items": [
    {
      "item_id": "0d3c8c276d079c4c225f034c69aa024cdab7869d",
      "source_path": "0d3c8c276d079c4c225f034c69aa024cdab7869d.txt",
      "source_sha256": "4afee57ad4f8db6bdf1e4009030393f2ee118dadcf32b511fdd6ac60343c2547"
    },
    {
      "item_id": "1b2cc634e2bfc6f2595260e7ed9b42f77ecbb0ce",
      "source_path": "1b2cc634e2bfc6f2595260e7ed9b42f77ecbb0ce.txt",
      "source_sha256": "72e398113547254cb4774e0fd5f6d7208b3c04f75d03c1d39dd199e9ef167168"
    },
    {
      "item_id": "1dd00c89d71a5611797bb34da8a6eada8f058405",
      "source_path": "1dd00c89d71a5611797bb34da8a6eada8f058405.txt",
      "source_sha256": "9cbbc2fcc54c1e7755cb7234a6116870ed83ecbf3cffd2ef07442c1477518eab"
    },
    {
      "item_id": "203886369feea77bbc35715e6d7e518b751f57de",
      "source_path": "203886369feea77bbc35715e6d7e518b751f57de.txt",
      "source_sha256": "c0e01d6fb4b3146b228a5ed81900eeb5fab11d10335b9685f51b803371443707"
    },
    {
      "item_id": "230c522854991d053fe98a718b1defa077a8efef",
      "source_path": "230c522854991d053fe98a718b1defa077a8efef.txt",
      "source_sha256": "c121e00e73012032814fa7b567d367696c4ae7e455c458a3152dcaaabd881a21"
    },
    {
      "item_id": "2bd8ada1de6a7b02f59430cc82045eb8d29cf033",
      "source_path": "2bd8ada1de6a7b02f59430cc82045eb8d29cf033.txt",
      "source_sha256": "a775622c220a7da1a33d03b6504f38b7fa46abfa8867599f500309b735b6d943"
    },
    {
      "item_id": "384175be1c8d41610fbeddbd9d9cb46e716e2529",
      "source_path": "384175be1c8d41610fbeddbd9d9cb46e716e2529.txt",
      "source_sha256": "3be8bca491964686642747d7462961a96d1176fceaa6929c7a85a5d224df026f"
    },
    {
      "item_id": "4495ba8f3a340d97a9df1476f8a35502bcce1f69",
      "source_path": "4495ba8f3a340d97a9df1476f8a35502bcce1f69.txt",
      "source_sha256": "e0faea833e05bd5db1889238f89c5673340d5343b40a0b5904616762e0cf774e"
    },
    {
      "item_id": "469c6ac05092ca5997728c9dfc19f9ab6b936e40",
      "source_path": "469c6ac05092ca5997728c9dfc19f9ab6b936e40.txt",
      "source_sha256": "43f5ca0dc706c1d5da359f249232b56357c1b8d7d98ff98b18495128eb6fce6a"
    },
    {
      "item_id": "6222f33c2c79b80be437335eeb3f488509e92cf5",
      "source_path": "6222f33c2c79b80be437335eeb3f488509e92cf5.txt",
      "source_sha256": "acf031ee61ac18f0c7e9f29591658d90e777771c5438c94f12d33f33a4db1f64"
    },
    {
      "item_id": "88e7dac40f3e6c159e4edc0747d0cc0f50886fbb",
      "source_path": "88e7dac40f3e6c159e4edc0747d0cc0f50886fbb.txt",
      "source_sha256": "1f0f0ec580fc158c3c040b624a0e6740b3c3fc36b927732d569f72461b7d6d38"
    },
    {
      "item_id": "a38e72fed88684ec8d60dd5856282e999dc8c0ca",
      "source_path": "a38e72fed88684ec8d60dd5856282e999dc8c0ca.txt",
      "source_sha256": "81bd708b1de926b5983a23068cb621f091724fecbd61ba8351263d41048dbbe8"
    },
    {
      "item_id": "c222979bd1cfbc7d3ff821e9c738e3dbd29b14f4",
      "source_path": "c222979bd1cfbc7d3ff821e9c738e3dbd29b14f4.txt",
      "source_sha256": "0651d739f6749a13503e4100d3b22c60a7904f1907da7fe1002ece59aa3c4553"
    },
    {
      "item_id": "c27cf1b136cc270023de959e7ab24638021bc43f",
      "source_path": "c27cf1b136cc270023de959e7ab24638021bc43f.txt",
      "source_sha256": "c76430aec33f0a7f63fbdb1a55ae7da46003a2898ca37ff73480027dfcb01f46"
    },
    {
      "item_id": "dc833f8b55e381011ce23f89ea909b9a141b5a66",
      "source_path": "dc833f8b55e381011ce23f89ea909b9a141b5a66.txt",
      "source_sha256": "e6c3118f590e678e6f398616309aa2b6e3952471245a8922069bfb75229722a5"
    },
    {
      "item_id": "e2706dce6cf26bc61b082438188fdb6e130d9e40",
      "source_path": "e2706dce6cf26bc61b082438188fdb6e130d9e40.txt",
      "source_sha256": "aa4f3fe14a1196fc7b9b1200a0eb356bb63f422eddd73c59201b70d3fe03a319"
    },
    {
      "item_id": "ec4b5fef725b4cc81545689603ff84c8e19bd6dc",
      "source_path": "ec4b5fef725b4cc81545689603ff84c8e19bd6dc.txt",
      "source_sha256": "98e6fcffe01583b665cc20b8f6a05f80c8f4e7afb4ec9551b2332496f875e170"
    },
    {
      "item_id": "ee17dfb574feca82ccac5689595e47483bd23f12",
      "source_path": "ee17dfb574feca82ccac5689595e47483bd23f12.txt",
      "source_sha256": "76961ae081bf396205fdad4867bc335f261fc8e286c1eda6f35cc98fda58c0de"
    },
    {
      "item_id": "eeafdc8b2d8130cabda5aafe352eab1198d0b9f8",
      "source_path": "eeafdc8b2d8130cabda5aafe352eab1198d0b9f8.txt",
      "source_sha256": "d53a9b4ee64fd0d74b375cb6c939e56227eae43641406c07ec423aa7ede3fd33"
    },
    {
      "item_id": "f001ec5c4704938247d27a44948eebb37ae98d01",
      "source_path": "f001ec5c4704938247d27a44948eebb37ae98d01.txt",
      "source_sha256": "e5eafe5c24f37c212bde0762205b657aa245db3436ecc74f344d1f8a20f862aa"
    }
  ],
  "source_dir": "data/sources/cnn_dailymail_20",
  "version": "1.0"
}
