{
  "created_at": "2026-09-24T07:52:45Z",
  "dataset_id": "tiny_v1",
  "description": "2 item(s) from sources/",
  "items": [
    {
      "item_id": "item_01",
      "source_path": "item_01.txt",
      "source_sha256": "9c530b220455e00527a434b6702e42be7bf2425169dc1ba742cd59f0f37e53ab"
    },
    {
      "item_id": "item_02",
      "source_path": "item_02.txt",
      "source_sha256": "a1541a44934017894797eb76361daedfc17b0ef52ef42b0f7cb3199d1d975fb1"
    }
  ],
  "source_dir": "/Users/claude/projects/agentic-ai-homelab/examples/eval-harness/data/sources",
  "version": "1.0"
}
