{
  "created_at": "2026-09-24T08:18:05Z",
  "dataset_id": "smoke_v1",
  "description": "5 item(s) from sources/",
  "items": [
    {
      "item_id": "item_01",
      "source_path": "item_01.txt",
      "source_sha256": "9c530b220455e00527a434b6702e42be7bf2425169dc1ba742cd59f0f37e53ab"
    },
    {
      "item_id": "item_02",
      "source_path": "item_02.txt",
      "source_sha256": "a1541a44934017894797eb76361daedfc17b0ef52ef42b0f7cb3199d1d975fb1"
    },
    {
      "item_id": "item_03",
      "source_path": "item_03.txt",
      "source_sha256": "62535e22572b20092d2dfc00d6af68f5b31a502110fe88ed2ccdbeaa885a905e"
    },
    {
      "item_id": "item_04",
      "source_path": "item_04.txt",
      "source_sha256": "db248ed9c3998606bb25971fd0031c2bccb560c13c6635bf2a6b9ba26461bc53"
    },
    {
      "item_id": "item_05",
      "source_path": "item_05.txt",
      "source_sha256": "d051e6d6435b9800cece2746423236ed1f7f94b788788de0c55292fe3046207f"
    }
  ],
  "source_dir": "/Users/claude/projects/agentic-ai-homelab/examples/eval-harness/data/sources",
  "version": "1.0"
}
